鄉鎮市區,交易標的,土地區段位置建物區段門牌,土地面積平方公尺,都市土地使用分區,非都市土地使用分區,非都市土地使用編定,租賃年月日,租賃筆棟數,租賃層次,總樓層數,建物型態,主要用途,主要建材,建築完成年月,建物總面積平方公尺,建物現況格局-房,建物現況格局-廳,建物現況格局-衛,建物現況格局-隔間,有無管理組織,有無附傢俱,總額元,單價元平方公尺,車位類別,車位面積平方公尺,車位總額元,備註,編號
The villages and towns urban district,transaction sign,land sector position building sector house number plate,land shifting total area square meter,the use zoning or compiles and checks,the non-metropolis land use district,non-metropolis land use,transaction year month and day,transaction pen number,shifting level,total floor number,building state,main use,main building materials,construction to complete the years,building shifting total area,Building present situation pattern - room,building present situation pattern - hall,building present situation pattern - health,building present situation pattern - compartmented,Whether there is manages the organization,Whether there is attaches the furniture,total price NTD,the unit price (NTD / square meter),the berth category,berth shifting total area square meter,the berth total price NTD,the note,serial number
西屯區,房地(土地+建物),臺中市西屯區臺灣大道四段751~780號,900.0,其他,,,1090501,土地1建物3車位0,見其他登記事項,12,辦公商業大樓,見其他登記事項,見其他登記事項,0801125,1288.24,0,0,0,無,無,有,227040,176,,0.0,0,,RPXNMLLKNHPFFCB68CC
南屯區,建物,臺中市南屯區保安七街61~90號,0.0,,,,1090509,土地0建物0車位0,五層,11,套房(1房1廳1衛),見其他登記事項,鋼筋混凝土造,1060817,34.43,1,1,1,有,有,有,7500,218,,0.0,0,,RPSOMLLKNHPFFCB28CC
南屯區,建物,臺中市南屯區保安七街61~90號,0.0,,,,1090509,土地0建物0車位0,四層,11,套房(1房1廳1衛),見其他登記事項,鋼筋混凝土造,1060817,41.37,1,1,1,有,有,有,10000,242,,0.0,0,,RPTOMLLKNHPFFCB38CC
南屯區,房地(土地+建物),臺中市南屯區大墩十街181~210號,13.01,住,,,1090416,土地1建物1車位0,五層,7,華廈(10層含以下有電梯),住家用,鋼筋混凝土造,0800611,134.20000000000002,3,2,2,有,有,有,18500,138,,0.0,0,,RPQPMLLKNHPFFCB18CC
北屯區,建物,臺中市北屯區熱河路三段93巷31~60號,0.0,住,,,1090420,土地0建物1車位1,見其他登記事項,16,店面(店鋪),住商用,鋼筋混凝土造,0801207,400.03999999999996,6,1,3,有,有,無,29000,72,坡道平面,0.0,0,門牌整編依謄本門牌申報。租賃期間含免租金裝潢期。車位面積無法分算。,RPXOMLLKNHPFFBB68CC
北區,房地(土地+建物)+車位,臺中市北區育樂街61~90號,9.43,商,,,1090424,土地1建物1車位1,十一層,21,住宅大樓(11層含以上有電梯),見其他登記事項,鋼筋混凝土造,1080513,72.71000000000001,1,1,1,有,有,有,14500,342,坡道平面,34.65,0,,RPVQMLLKNHPFFBB68CC
北區,房地(土地+建物),臺中市北區西屯路二段1~30號,7.56,住,,,1090424,土地1建物1車位0,八層,12,住宅大樓(11層含以上有電梯),國民住宅,鋼筋混凝土造,0820503,121.94,3,2,2,有,有,無,17000,139,,0.0,0,,RPXQMLLKNHPFFBB88CC
北區,房地(土地+建物)+車位,臺中市北區育樂街61~90號,9.43,商,,,1090420,土地1建物1車位2,九層,21,住宅大樓(11層含以上有電梯),見其他登記事項,鋼筋混凝土造,1080513,72.71000000000001,1,1,1,有,有,有,16500,227,其他,0.0,0,,RPURMLLKNHPFFBB68CC
西區,房地(土地+建物),臺中市西區五權路121~150號,41.99,商,,,1090416,土地1建物1車位0,見其他登記事項,11,店面(店鋪),住商用,鋼筋混凝土造,0730726,179.18,3,2,3,有,有,無,30000,167,,0.0,0,,RPWNMLLKNHPFFAB38CC
南區,房地(土地+建物)+車位,臺中市南區大慶街一段130巷31~60號,17.81,住,,,1090405,土地1建物1車位2,六層,12,住宅大樓(11層含以上有電梯),見其他登記事項,鋼筋混凝土造,0970624,117.45,3,2,2,有,有,有,18000,236,坡道機械,45.14,0,,RPSOMLLKNHPFFAB08CC
清水區,房地(土地+建物)+車位,臺中市清水區港新五路211~240號,21.84,商,,,1090509,土地1建物1車位1,十四層,15,住宅大樓(11層含以上有電梯),見其他登記事項,鋼筋混凝土造,1060905,168.17000000000002,3,2,2,有,有,有,22500,134,坡道平面,34.35,0,,RPSNMLLKNHPFFFB48CC
清水區,房地(土地+建物)+車位,臺中市清水區港新三路1~30號,14.99,商,,,1090507,土地1建物1車位1,八層,15,住宅大樓(11層含以上有電梯),見其他登記事項,鋼筋混凝土造,1070926,112.13,2,2,1,有,有,有,18500,165,坡道平面,32.25,0,,RPRNMLMKNHPFFFB48CC
南區,房地(土地+建物),臺中市南區南和路151~180號,16.54,住,,,1090424,土地1建物1車位0,四層,15,住宅大樓(11層含以上有電梯),見其他登記事項,鋼筋混凝土造,1030821,125.38,3,2,2,有,有,有,21000,167,,0.0,0,,RPWNMLMKNHPFFAB48CC
南區,房地(土地+建物)+車位,臺中市南區復興北路1~30號,5.0,住,,,1090424,土地1建物1車位1,二層,15,住宅大樓(11層含以上有電梯),見其他登記事項,鋼筋混凝土造,1081007,62.34,1,1,1,有,有,有,15500,249,坡道平面,33.34,0,,RPOOMLMKNHPFFAB77CC
中區,建物,臺中市中區臺灣大道一段301~330號,0.0,商,,,1090421,土地0建物1車位0,六層,12,套房(1房1廳1衛),商業用,鋼筋混凝土造,0810914,13.45,1,0,1,有,無,有,3000,223,,0.0,0,,RPQOMLMKNHPFFAB97CC
南區,建物,臺中市南區學府路151~180號,0.0,住,,,1090421,土地0建物2車位1,見其他登記事項,15,店面(店鋪),住商用,鋼筋混凝土造,0831228,361.97,0,2,1,有,有,無,36000,99,坡道平面,0.0,0,兩個門牌。車位面積無法分算。,RPUOMLMKNHPFFAB38CC
北區,房地(土地+建物)+車位,臺中市北區育樂街61~90號,9.43,商,,,1090420,土地1建物1車位2,七層,21,住宅大樓(11層含以上有電梯),見其他登記事項,鋼筋混凝土造,1080513,72.71000000000001,1,1,1,有,有,有,16500,227,其他,0.0,0,,RPROMLMKNHPFFBB18CC
北屯區,房地(土地+建物),臺中市北屯區安順東二街1~30號,15.04,住,,,1090420,土地1建物1車位0,六層,11,住宅大樓(11層含以上有電梯),住家用,鋼筋混凝土造,0811124,109.47,2,2,2,有,有,有,19200,175,,0.0,0,,RPTOMLMKNHPFFBB38CC
北區,房地(土地+建物),臺中市北區青島一街1~30號,25.56,住,,,1090423,土地1建物1車位0,五層,5,公寓(5樓含以下無電梯),住家用,鋼筋混凝土造,0730803,90.57,3,2,1,有,無,有,14000,155,,0.0,0,,RPUOMLMKNHPFFBB48CC
北區,房地(土地+建物)+車位,臺中市北區育樂街61~90號,9.52,商,,,1090430,土地1建物1車位1,六層,21,住宅大樓(11層含以上有電梯),見其他登記事項,鋼筋混凝土造,1080513,74.17,1,1,1,有,有,有,17000,388,坡道平面,30.64,0,,RPOPMLMKNHPFFBB97CC
西屯區,建物,臺中市西屯區朝富路211~240號,0.0,其他,,,1090416,土地0建物0車位0,,34,辦公商業大樓,見其他登記事項,鋼骨鋼筋混凝土造,1040924,21.48,12,0,0,有,有,無,20000,931,,0.0,0,,RPXNMLMKNHPFFCB78CC
南屯區,房地(土地+建物)+車位,臺中市南屯區黎明路二段481~510號,47.12,住,,,1090505,土地1建物2車位1,見其他登記事項,16,住宅大樓(11層含以上有電梯),住家用,鋼筋混凝土造,0831024,270.85,5,2,3,有,有,有,25000,92,坡道平面,29.75,0,,RPUPMLMKNHPFFCB68CC
西屯區,建物,臺中市西屯區國安一路121~150號,0.0,,,,1090511,土地0建物1車位0,三層,24,住宅大樓(11層含以上有電梯),住家用,鋼筋混凝土造,0991119,43.28,2,2,1,有,有,有,17000,393,,0.0,0,,RPVPMLMKNHPFFCB78CC
南屯區,建物,臺中市南屯區大昌街451~480號,0.0,住,,,1090425,土地0建物1車位1,四層,7,華廈(10層含以下有電梯),住家用,鋼筋混凝土造,0821116,99.36000000000001,2,2,1,有,無,有,16000,161,升降機械,8.42,0,,RPQQMLMKNHPFFCB38CC
西屯區,房地(土地+建物)+車位,臺中市西屯區大恩街1~30號,23.29,住,,,1080508,土地1建物1車位1,七層,12,住宅大樓(11層含以上有電梯),國民住宅,鋼筋混凝土造,0851118,190.59,3,2,2,有,有,有,17100,90,坡道平面,0.0,0,臺中市包租代管案件租金市價打9折。因此案件為社會住宅包租代管案件因素，此租約訂定金額不含管理費、車位租金，管理費、停車位費用為承租人另行支付。,RPTNMLNKNHPFFCB48CC
南屯區,房地(土地+建物),臺中市南屯區市政南二路151~180號,180.0,住,,,1090423,土地1建物1車位0,一層,1,店面(店鋪),住商用,鋼造,0730302,180.0,0,1,1,有,無,無,80000,444,,0.0,0,109/4/23-109/8/22 裝潢期每月租金4萬109/8/23-109/12/22每月租金8萬109/12/23-110/6/22每月租金9萬110/6/23-112/6/22每月租金10萬112/6/23-114/6/22每月租金11萬,RPSOMLNKNHPFFCB48CC
南區,建物,臺中市南區高工南路65巷1~30號,0.0,住,,,1090425,土地0建物1車位1,六層,11,住宅大樓(11層含以上有電梯),見其他登記事項,鋼筋混凝土造,1050922,187.95,4,2,2,有,有,有,26000,138,坡道平面,29.75,0,租金含管理費。,RPOQMLNKNHPFFAB08CC
潭子區,建物,臺中市潭子區復興路一段1巷1~30號,0.0,住,,,1090424,土地0建物1車位0,全,4,透天厝,住商用,鋼筋混凝土造,0850829,235.03,5,3,3,有,無,無,35000,149,,0.0,0,有民情風俗因素之交易。;,RPUNMLOKNHPFFHB56CC
西區,房地(土地+建物),臺中市西區三民路一段50巷1~30號,2.91,住,,,1090416,土地1建物1車位0,三層,19,住宅大樓(11層含以上有電梯),住家用,鋼筋混凝土造,0840113,38.33,1,1,1,有,有,有,7200,188,,0.0,0,,RPROMLOKNHPFFAB38DC
北屯區,房地(土地+建物),臺中市北屯區松竹路二段361~390號,5.96,住,,,1090502,土地1建物1車位0,十二層,16,住宅大樓(11層含以上有電梯),住家用,鋼筋混凝土造,0831210,46.01,1,1,1,有,有,有,9000,196,,0.0,0,親友、員工或其他特殊關係間之交易。;,RPWPMLOKNHPFFBB09DC
北區,房地(土地+建物),臺中市北區漢口路四段61~90號,3.37,住,,,1090502,土地1建物1車位0,六層,14,套房(1房1廳1衛),住家用,鋼筋混凝土造,0850715,31.97,1,1,1,有,有,有,6500,203,,0.0,0,親友、員工或其他特殊關係間之交易。;,RPXPMLOKNHPFFBB56DC
北區,房地(土地+建物),臺中市北區英才路211~240號,6.43,住,,,1090423,土地1建物1車位0,七層,8,華廈(10層含以下有電梯),住家用,鋼筋混凝土造,0830907,42.71,1,1,1,有,有,有,7000,164,,0.0,0,親友、員工或其他特殊關係間之交易。;,RPOQMLOKNHPFFBB38DC
烏日區,土地,高鐵段361~390地號,330.0,其他,,,1090415,土地1建物0車位0,,,其他,,,,0.0,0,0,0,有,無,無,40000,121,,0.0,0,有民情風俗因素之交易。;上有鐵皮廠房,RPRNMLOKNHPFFIB09DC
太平區,房地(土地+建物),臺中市太平區太平路541~570號,98.16,住,,,1090413,土地1建物1車位0,一層,2,店面(店鋪),見其他登記事項,加強磚造,0610201,55.42,0,0,0,無,無,無,19000,343,,0.0,0,,RPPNMLOKNHPFFJB98DC
北區,房地(土地+建物)+車位,臺中市北區臺灣大道二段331~360號,9.4,住,,,1090414,土地2建物1車位1,十八層,28,辦公商業大樓,見其他登記事項,鋼骨鋼筋混凝土造,0890603,177.76999999999998,0,0,0,無,有,有,45000,253,坡道機械,0.0,0,,RPQPMLOKNHPFFBB38CC
北區,房地(土地+建物)+車位,臺中市北區太原路一段511~540號,22.71,住,,,1090416,土地2建物1車位1,十層,11,辦公商業大樓,商業用,鋼筋混凝土造,0800604,191.76999999999998,0,0,0,無,有,無,30000,156,坡道機械,0.0,0,,RPWQMLOKNHPFFBB09CC
西屯區,房地(土地+建物)+車位,臺中市西屯區河南路二段241~270號,31.31,商,,,1090430,土地1建物1車位1,八層,13,辦公商業大樓,商業用,鋼筋混凝土造,0800613,242.61,0,0,0,無,有,無,40000,165,坡道機械,0.0,0,,RPPQMLOKNHPFFCB48CC
西屯區,房地(土地+建物),臺中市西屯區市政北七路181~210號,1299.22,其他,,,1090430,土地1建物1車位0,二十四層,28,辦公商業大樓,見其他登記事項,鋼筋混凝土造,1060321,209.57999999999998,0,0,0,無,有,無,60230,287,,0.0,0,,RPTQMLOKNHPFFCB88CC
西屯區,建物,臺中市西屯區何厝街37巷1~30號,0.0,其他,,,1090426,土地0建物1車位1,二層,12,住宅大樓(11層含以上有電梯),住家用,鋼筋混凝土造,1010710,161.01,3,2,2,有,有,有,24000,149,坡道平面,31.44,0,,RPWQMLOKNHPFFCB56CC
西屯區,房地(土地+建物),臺中市西屯區櫻城五街1~30號,11.61,住,,,1090415,土地1建物1車位0,八層,8,華廈(10層含以下有電梯),住家用,鋼筋混凝土造,0840621,69.18,2,2,2,有,無,有,14000,202,,0.0,0,,RPOOMLPKNHPFFCB28CC
西屯區,房地(土地+建物),臺中市西屯區永輝路91~120號,442.0,工,,,1090423,土地1建物1車位0,見其他登記事項,3,工廠,見其他登記事項,鋼筋混凝土造,0971113,1856.01,0,0,0,無,無,無,250000,,,0.0,0,,RPXOMLPKNHPFFCB56CC
南屯區,建物,臺中市南屯區大墩十六街1~30號,0.0,住,,,1090427,土地0建物1車位1,四層,7,華廈(10層含以下有電梯),住家用,鋼筋混凝土造,0800613,212.75,4,2,2,有,有,有,21800,102,坡道平面,0.0,0,,RPRPMLPKNHPFFCB68CC
北區,房地(土地+建物),臺中市北區太平路19巷5弄31~60號,423.0,住,,,1090427,土地11建物3車位0,見其他登記事項,2,店面(店鋪),住家用,磚造,0560726,162.09,0,0,0,無,無,無,260000,1604,,0.0,0,三個門牌。,RPTQMLPKNHPFFBB88CC
北屯區,房地(土地+建物),臺中市北屯區文心路四段271~300號,10.5,住,,,1090502,土地1建物1車位0,十五層,22,住宅大樓(11層含以上有電梯),住家用,鋼筋混凝土造,1020725,125.14000000000001,2,1,2,有,有,有,24000,192,,0.0,0,,RPXQMLPKNHPFFBB66CC
北屯區,房地(土地+建物)+車位,臺中市北屯區文心路四段271~300號,10.16,住,,,1090429,土地1建物1車位1,八層,22,住宅大樓(11層含以上有電梯),住家用,鋼筋混凝土造,1020725,119.55,2,1,2,有,有,有,26000,217,坡道平面,0.0,0,,RPORMLPKNHPFFBB48CC
北屯區,房地(土地+建物)+車位,臺中市北屯區文心路四段271~300號,10.29,住,,,1090430,土地1建物1車位1,十四層,22,住宅大樓(11層含以上有電梯),住家用,鋼筋混凝土造,1020725,113.21000000000001,2,1,1,有,有,有,26000,230,坡道機械,0.0,0,,RPPRMLPKNHPFFBB58CC
西區,房地(土地+建物)+車位,臺中市西區東興路三段151~180號,217.0,住,,,1090511,土地1建物1車位1,見其他登記事項,14,店面(店鋪),住家用,鋼筋混凝土造,0830625,128.47,0,0,2,有,無,有,85000,662,坡道平面,0.0,0,,RPXOMLPKNHPFFAB98CC
南區,房地(土地+建物),臺中市南區忠明南路781~810號,13.23,住,,,1090430,土地1建物1車位0,二十一層,42,辦公商業大樓,商業用,見其他登記事項,0821218,315.91999999999996,0,0,0,無,有,無,42000,133,,0.0,0,,RPTQMLPKNHPFFAB78CC
北屯區,房地(土地+建物)+車位,臺中市北屯區崇德十六路151~180號,20.93,住,,,1090509,土地2建物1車位1,四層,15,住宅大樓(11層含以上有電梯),見其他登記事項,鋼筋混凝土造,1081122,181.22,3,2,2,有,有,無,27000,149,坡道平面,33.07,0,,RPPNMLQKNHPFFBB28CC
北屯區,房地(土地+建物),臺中市北屯區遼陽北一街31~60號,9.91,住,,,1090419,土地1建物1車位0,一層,7,華廈(10層含以下有電梯),住商用,鋼筋混凝土造,0821201,52.06999999999999,0,0,1,有,無,無,8000,154,,0.0,0,,RPSNMLQKNHPFFBB58CC
南屯區,房地(土地+建物)+車位,臺中市南屯區大業路541~570號,13.53,住,,,1090430,土地1建物1車位1,十三層,16,住宅大樓(11層含以上有電梯),住家用,鋼筋混凝土造,0840128,121.5,3,2,2,有,有,有,41000,337,坡道平面,0.0,0,,RPPNMLQKNHPFFCB38CC
南屯區,建物,臺中市南屯區保安七街61~90號,0.0,,,,1090514,土地0建物0車位0,二層,11,套房(1房1廳1衛),見其他登記事項,鋼筋混凝土造,1060817,41.92,1,1,1,有,有,有,9000,215,,0.0,0,,RPRNMLQKNHPFFCB58CC
西屯區,房地(土地+建物),臺中市西屯區華美西街二段301~330號,22.71,住,,,1090504,土地1建物1車位0,九層,15,辦公商業大樓,見其他登記事項,鋼筋混凝土造,0780916,183.75,0,0,0,無,有,無,22000,120,,0.0,0,,RPOOMLSKNHPFFCB58CC
西屯區,房地(土地+建物)+車位,臺中市西屯區朝富路211~240號,14.77,其他,,,1090506,土地1建物1車位1,二十三層,34,辦公商業大樓,見其他登記事項,鋼骨鋼筋混凝土造,1040924,257.08,0,0,0,無,有,無,70000,272,坡道平面,0.0,4000,,RPXOMLSKNHPFFCB86CC
西屯區,房地(土地+建物)+車位,臺中市西屯區安和路151~180號,39.73,住,,,1090507,土地2建物1車位1,五層,11,辦公商業大樓,見其他登記事項,鋼筋混凝土造,1040320,214.06,0,0,0,無,有,無,60166,281,坡道平面,0.0,3300,,RPOPMLSKNHPFFCB68CC
南屯區,建物,臺中市南屯區保安十街1~30號,0.0,住,,,1090428,土地0建物1車位0,一層,15,店面(店鋪),見其他登記事項,鋼筋混凝土造,1080825,121.95,0,1,1,有,有,有,32000,262,,0.0,0,租金含管理費。,RPTPMLSKNHPFFCB56CC
南屯區,建物,臺中市南屯區河南路四段331~360號,0.0,住,,,1090429,土地0建物1車位0,三層,10,住宅大樓(11層含以上有電梯),住家用,鋼筋混凝土造,0941220,31.32,1,1,1,有,有,有,7000,223,,0.0,0,租金含管理費。,RPWPMLSKNHPFFCB86CC
西屯區,房地(土地+建物),臺中市西屯區安和路151~180號,31.27,住,,,1090512,土地2建物1車位0,十層,11,辦公商業大樓,見其他登記事項,鋼筋混凝土造,1040320,171.61,0,0,0,無,有,無,39880,232,,0.0,0,,RPWQMLSKNHPFFCB96CC
西屯區,房地(土地+建物)+車位,臺中市西屯區市政北七路181~210號,13.47,其他,,,1090512,土地1建物1車位1,,28,辦公商業大樓,見其他登記事項,鋼筋混凝土造,1060321,229.5,0,0,0,無,有,無,58500,255,坡道平面,0.0,3500,,RPXQMLSKNHPFFCB07CC
北區,房地(土地+建物)+車位,臺中市北區中清路一段91~120號,63.55,商,,,1090508,土地1建物2車位4,五層,20,辦公商業大樓,見其他登記事項,鋼筋混凝土造,0801130,870.4100000000001,0,0,0,無,有,無,135000,155,坡道機械,0.0,0,,RPSRMLSKNHPFFBB56CC
北屯區,建物,臺中市北屯區敦化路一段631~660號,0.0,住,,,1090429,土地0建物1車位1,十二層,12,住宅大樓(11層含以上有電梯),見其他登記事項,鋼筋混凝土造,1060310,118.42,2,2,1,有,有,有,23000,194,坡道機械,24.44,0,租金含管理費。,RPTSMLSKNHPFFBB76CC
北屯區,房地(土地+建物),臺中市北屯區昌平路一段271~300號,32.62,住,,,1090509,土地1建物1車位0,四層,4,公寓(5樓含以下無電梯),住家用,鋼筋混凝土造,0721005,91.91,3,2,1,有,無,有,13200,144,,0.0,0,臺中市包租代管案件租金市價打9折。,RPUSMLSKNHPFFBB86CC
北屯區,房地(土地+建物),臺中市北屯區瀋陽路二段121~150號,32.13,住,,,1090419,土地1建物1車位0,二層,5,公寓(5樓含以下無電梯),住家用,鋼筋混凝土造,0711116,111.89999999999999,3,2,2,有,無,有,15000,134,,0.0,0,,RPTTMLSKNHPFFBB86CC
西區,房地(土地+建物)+車位,臺中市西區公益路361~390號,22.7,住,,,1090511,土地1建物1車位1,七層,17,辦公商業大樓,商業用,鋼筋混凝土造,0800118,231.36,0,0,0,無,有,無,45494,197,坡道平面,0.0,0,,RPOQMLSKNHPFFAB58CC
中區,房地(土地+建物),臺中市中區三民路二段31~60號,1.0,商,,,1090509,土地1建物1車位0,五層,12,住宅大樓(11層含以上有電梯),住家用,鋼筋混凝土造,0740521,30.049999999999997,1,0,1,有,有,有,7000,233,,0.0,0,臺中市包租代管案件租金市價打9折。,RPQQMLSKNHPFFAB78CC
西區,房地(土地+建物)+車位,臺中市西區臺灣大道二段481~510號,17.08,商,,,1090515,土地1建物1車位1,二十三層,23,住宅大樓(11層含以上有電梯),見其他登記事項,鋼筋混凝土造,1011121,246.49,2,2,2,有,無,無,50721,206,坡道平面,27.59,0,,RPRQMLSKNHPFFAB88CC
潭子區,建物,臺中市潭子區環中路一段258巷31~60號,0.0,農,,,1090428,土地0建物1車位1,全,4,透天厝,見其他登記事項,見其他登記事項,0990915,186.39000000000001,4,3,4,有,有,有,25000,134,其他,0.0,0,有民情風俗因素之交易。;租金含管理費。車位面積無法分算。,RPUNMLSKNHPFFHB96CC
烏日區,建物,臺中市烏日區健行路271~300號,2.9,住,,,1090428,土地0建物0車位0,五層,5,套房(1房1廳1衛),見其他登記事項,鋼筋混凝土造,1070119,29.23,1,0,1,有,無,有,10600,363,,0.0,0,,RPVNMLSKNHPFFIB17CC
大里區,房地(土地+建物),臺中市大里區現岱路1~30號,9.08,住,,,1090428,土地1建物1車位0,八層,14,住宅大樓(11層含以上有電梯),見其他登記事項,鋼筋混凝土造,0990325,62.79,2,2,1,有,無,有,18000,287,,0.0,0,,RPWOMLSKNHPFFIB37CC
清水區,房地(土地+建物)+車位,臺中市清水區港新五路211~240號,12.86,商,,,1090516,土地1建物1車位1,十三層,15,住宅大樓(11層含以上有電梯),見其他登記事項,鋼筋混凝土造,1060905,96.66,2,1,1,有,有,有,12000,124,坡道平面,34.35,0,,RPRNMLSKNHPFFFB09CC
南區,房地(土地+建物),臺中市南區工學北路61~90號,1.83,商,,,1090519,土地1建物1車位0,九層,18,套房(1房1廳1衛),見其他登記事項,鋼筋混凝土造,0850506,31.04,1,0,0,無,有,有,6000,193,,0.0,0,,RPSNMLTKNHPFFAB78CC
西區,建物,臺中市西區忠明南路91~120號,0.0,住,,,1090430,土地0建物1車位0,三層,15,住宅大樓(11層含以上有電梯),見其他登記事項,鋼筋混凝土造,0951222,89.86000000000001,1,2,1,有,有,有,28000,312,,0.0,0,租期內含免租裝潢期。租金含管理費。,RPTPMLTKNHPFFAB09CC
西區,房地(土地+建物),臺中市西區三民路一段50巷1~30號,2.16,住,,,1090517,土地2建物1車位0,十一層,19,住宅大樓(11層含以上有電梯),住家用,鋼筋混凝土造,0840113,28.8,1,0,1,有,有,有,6000,208,,0.0,0,,RPUPMLTKNHPFFAB56CC
北區,房地(土地+建物),臺中市北區漢口南二街61~90號,118.0,住,,,1090511,土地1建物1車位0,全,3,透天厝,住商用,鋼筋混凝土造,0750630,265.24,2,2,3,有,無,無,22000,83,,0.0,0,,RPRQMLTKNHPFFBB09CC
北屯區,房地(土地+建物),臺中市北屯區崇德三路1~30號,67.0,住,,,1090504,土地1建物1車位0,全,2,透天厝,住家用,鋼筋混凝土加強磚造,0620213,54.53,0,0,0,無,無,無,6000,110,,0.0,0,,RPSQMLTKNHPFFBB56CC
南屯區,房地(土地+建物),臺中市南屯區大墩五街271~300號,86.0,其他,,,1090515,土地1建物1車位0,見其他登記事項,4,店面(店鋪),住商用,鋼筋混凝土造,0761030,99.65,2,1,1,有,無,有,16000,161,,0.0,0,,RPUNMLTKNHPFFCB56CC
南屯區,建物,臺中市南屯區保安七街61~90號,0.0,,,,1090516,土地0建物0車位0,十層,11,套房(1房1廳1衛),見其他登記事項,鋼筋混凝土造,1060817,39.78,1,1,1,有,有,有,9000,226,,0.0,0,,RPQOMLTKNHPFFCB88CC
南屯區,建物,臺中市南屯區保安七街61~90號,0.0,,,,1090516,土地0建物0車位0,十層,11,套房(1房1廳1衛),見其他登記事項,鋼筋混凝土造,1060817,41.53,1,1,1,有,有,有,11000,265,,0.0,0,,RPROMLTKNHPFFCB98CC
南屯區,建物,臺中市南屯區保安七街61~90號,0.0,,,,1090516,土地0建物0車位0,六層,11,套房(1房1廳1衛),見其他登記事項,鋼筋混凝土造,1060817,34.39,1,1,1,有,有,有,8500,247,,0.0,0,,RPSOMLTKNHPFFCB09CC
南屯區,土地,永新段61~90地號,659.5,住,,,1090518,土地1建物0車位0,,,其他,,,,0.0,0,0,0,有,無,無,113520,172,,0.0,0,民國109年06月01日至109年11月30日為建設期間六個月，免收租金。自民國109年12月01日起至112年12月01日，每月租金新台幣113520元整。自民國112年12月02日起至民國115年12月01日，每月租金調漲新台幣壹萬元整。自民國115年12月02日起至民國118年12月01日，每月租金調漲新台幣壹萬元整。自民國118年12月02日起至民國121年12月01日，每月租金調漲新台幣壹萬元整。,RPOPMLTKNHPFFCB78CC
西屯區,房地(土地+建物),臺中市西屯區精明二街31~60號,77.0,住,,,1090506,土地2建物1車位0,全,4,透天厝,住商用,鋼筋混凝土造,0700409,234.7,0,0,0,無,無,無,23000,98,,0.0,0,使用範圍包含地下室及梯間廁所,RPXQMLTKNHPFFCB17CC
西屯區,房地(土地+建物),臺中市西屯區西安街76巷1弄1~30號,173.0,住,,,1090519,土地1建物1車位0,全,2,透天厝,住家用,見其他登記事項,0620515,102.24,0,0,0,有,無,無,38500,377,,0.0,0,,RPPNMLKLNHPFFCB87CC
西屯區,房地(土地+建物),臺中市西屯區經貿五路61~90號,1049.51,住,,,1090513,土地2建物3車位0,一層,5,店面(店鋪),見其他登記事項,見其他登記事項,1050909,372.61,0,0,0,無,無,無,100000,268,,0.0,0,"租期為109/09/16-118/09/15止,每月租金為新台幣100000元整,自第1-5年每月為100000元整,第6-9年每月租金調5%金額為新台幣105000元整,。乙方第一年期款一次開立12張支票為支付租金交甲方收受。ˇ第二年以後租金案悅匯入甲方指定帳戶。押金:乙方應於訂合約時,交付甲方新台幣200000元整,作為押金,乙方期滿不繼續承租,交還租賃標的物後無息退還押金。",RPTNMLKLNHPFFCB28CC
西屯區,建物,臺中市西屯區西屯路三段151~180號,0.0,住,,,1090429,土地0建物1車位1,六層,21,住宅大樓(11層含以上有電梯),住家用,鋼筋混凝土造,1031119,175.28,3,2,2,有,有,有,25000,143,坡道平面,39.74,0,租金含管理費。,RPWQMLKLNHPFFCB88CC
南屯區,建物,臺中市南屯區五權西路二段781~810號,0.0,住,,,1090501,土地0建物1車位1,三層,15,住宅大樓(11層含以上有電梯),住家用,鋼筋混凝土造,0990120,187.46,3,2,2,有,有,有,23000,123,坡道平面,28.9,0,,RPPSMLKLNHPFFCB38CC
豐原區,房地(土地+建物),臺中市豐原區圓環東路451~480號,137.46,住,,,1090511,土地1建物1車位0,見其他登記事項,4,店面(店鋪),見其他登記事項,鋼筋混凝土造,1071210,340.91,0,0,0,無,無,無,70000,205,,0.0,0,,RPQNMLKLNHPFFDB08CC
